{
  "id": "arcanist_hoarfrost_legs_male",
  "kind": "piece",
  "builder": "build_piece.py",
  "seed": 1,
  "body_build": "male",
  "tri_budget": {
    "min": 9600,
    "max": 13200
  },
  "texture_size": 4096,
  "params": {
    "slot": "legs",
    "design": "arcanist_underskirt",
    "set": "arcanist_hoarfrost",
    "armor_type": "cloth",
    "tris": 12000
  },
  "out": "game/assets/armor/arcanist_hoarfrost_legs_male.gltf",
  "status": "draft"
}
