{
  "id": "oracle_dawnveil_shoulders_female",
  "kind": "piece",
  "builder": "build_piece.py",
  "seed": 1,
  "body_build": "female",
  "tri_budget": {
    "min": 8000,
    "max": 11000
  },
  "texture_size": 2048,
  "params": {
    "slot": "shoulders",
    "design": "oracle_shoulder_caps",
    "set": "oracle_dawnveil",
    "armor_type": "cloth",
    "tris": 10000
  },
  "out": "game/assets/armor/oracle_dawnveil_shoulders_female.gltf",
  "status": "draft"
}
