{
  "id": "oracle_dawnveil_legs_female",
  "kind": "piece",
  "builder": "build_piece.py",
  "seed": 1,
  "body_build": "female",
  "tri_budget": {
    "min": 9600,
    "max": 13200
  },
  "texture_size": 4096,
  "params": {
    "slot": "legs",
    "design": "oracle_underskirt",
    "set": "oracle_dawnveil",
    "armor_type": "cloth",
    "tris": 12000
  },
  "out": "game/assets/armor/oracle_dawnveil_legs_female.gltf",
  "status": "draft"
}
