{
  "id": "warblade_ironreaver_hands_female",
  "kind": "piece",
  "builder": "build_piece.py",
  "seed": 1,
  "body_build": "female",
  "tri_budget": {
    "min": 6400,
    "max": 8800
  },
  "texture_size": 2048,
  "params": {
    "slot": "hands",
    "design": "warblade_gauntlets",
    "set": "warblade_ironreaver",
    "armor_type": "plate",
    "tris": 8000
  },
  "out": "game/assets/armor/warblade_ironreaver_hands_female.gltf",
  "status": "draft"
}
