{
  "id": "foundry_ingot_stack",
  "kind": "prop",
  "builder": "build_kit_foundry.py",
  "seed": 144,
  "tri_budget": {
    "min": 200,
    "max": 2500
  },
  "texture_size": 512,
  "palette": {
    "brick": "#54423a",
    "brick_dark": "#2e2522",
    "mortar": "#1a1614",
    "paver": "#5a4a40",
    "iron": "#2f3133",
    "rust": "#6a3a22",
    "heat": "#3d2b36",
    "scorch": "#6e3219",
    "slag": "#3a3530",
    "molten": "#ff5a0c",
    "ember": "#c2410c",
    "coal": "#141210",
    "ash": "#77706a",
    "sand": "#3f352d",
    "pig_iron": "#4a4744",
    "wood": "#66503a",
    "void": "#0c0a09",
    "far_brick": "#3b302b",
    "far_roof": "#2c2f33"
  },
  "params": {
    "piece": "ingot_stack"
  },
  "out": "game/assets/kits/foundry/foundry_ingot_stack.glb",
  "status": "draft"
}
