{
  "id": "gallows_wall_b",
  "kind": "environment_kit",
  "builder": "build_kit_gallows.py",
  "seed": 12,
  "tri_budget": {
    "min": 1500,
    "max": 7000
  },
  "texture_size": 1024,
  "palette": {
    "stone": "#6d6961",
    "flag": "#5b5852",
    "mortar": "#2c2a27",
    "wood": "#6b4a30",
    "dark_wood": "#46301f",
    "iron": "#3c3f44",
    "rope": "#8a7654",
    "emblem": "#d8ccb0"
  },
  "params": {
    "width_m": 4.0,
    "height_m": 6.0,
    "piece": "wall"
  },
  "out": "game/assets/kits/gallows/gallows_wall_b.glb",
  "status": "draft",
  "pivot": "face"
}
