{
  "id": "arcanist_hoarfrost_waist_female",
  "kind": "piece",
  "builder": "build_piece.py",
  "seed": 1,
  "body_build": "female",
  "tri_budget": {
    "min": 2400,
    "max": 3300
  },
  "texture_size": 2048,
  "params": {
    "slot": "waist",
    "design": "arcanist_sash",
    "set": "arcanist_hoarfrost",
    "armor_type": "cloth",
    "tris": 3000
  },
  "out": "game/assets/armor/arcanist_hoarfrost_waist_female.gltf",
  "status": "draft"
}
