{
  "id": "hair_braided_female",
  "kind": "piece",
  "builder": "build_piece.py",
  "seed": 1,
  "body_build": "female",
  "tri_budget": {
    "min": 8800,
    "max": 12100
  },
  "texture_size": 2048,
  "palette": {
    "hair": "#b4aa9e"
  },
  "params": {
    "slot": "hair",
    "style": "braided",
    "target_tris": 11000,
    "voxel": 0.0015
  },
  "out": "game/assets/appearance/hair_braided_female.gltf",
  "status": "draft"
}
