{
  "id": "templar_crusader_shoulders_female",
  "kind": "piece",
  "builder": "build_piece.py",
  "seed": 1,
  "body_build": "female",
  "tri_budget": {
    "min": 8000,
    "max": 11000
  },
  "texture_size": 2048,
  "params": {
    "slot": "shoulders",
    "design": "templar_spaulders",
    "set": "templar_crusader",
    "armor_type": "plate",
    "tris": 10000
  },
  "out": "game/assets/armor/templar_crusader_shoulders_female.gltf",
  "status": "draft"
}
